{
  "$id": "https://raw.githubusercontent.com/LF-Decentralized-Trust-labs/decentralized-directory-protocol/main/schemas/dedi-file.json",
  "$schema": "http://json-schema.org/draft-07/schema#",
  "title": "DeDi File",
  "description": "A self-contained, signed JSON document holding one registry (directory) and its records. Served as application/json; the dedi.<registry-name>.json filename and /dedi/ directory are RECOMMENDED conventions, not conformance requirements. Hosted by the publisher at any URL it controls, or embedded verbatim as an inline entry in the manifest's files[] (shape and verification unchanged; source_url is then the manifest's well-known URL); discovered, verified and served by DeDi servers. Authenticity is established by confirming publisher.key appears in the keys of the publisher's signed /.well-known/dedi.index.json. See docs/publishing-dedi-files.md. NOTE: the schema $id points at the mutable main branch and must be pinned to a release tag before release.",
  "type": "object",
  "required": ["dedi_version", "type", "source_url", "next_update", "publisher", "namespace", "registry", "records", "proof"],
  "additionalProperties": false,
  "properties": {
    "dedi_version": { "type": "string", "description": "Version of the DeDi file format, e.g. '0.1'." },
    "type": { "type": "string", "const": "dedi-file", "description": "Discriminator identifying this document as a DeDi file. Required: the dedi.*.json filename and /dedi/ path are conventions only, so a conformant file may arrive with neither. This is the one self-identification that always travels with the content." },
    "source_url": { "type": "string", "format": "uri", "description": "Canonical location; used to re-fetch a fresher copy after the file has been relocated to a mirror." },
    "next_update": { "type": "string", "format": "date-time", "description": "After this time the file MUST be treated as stale and re-fetched from source_url before being relied upon." },
    "publisher": {
      "type": "object",
      "required": ["domain", "key"],
      "additionalProperties": false,
      "properties": {
        "domain": { "type": "string", "description": "Publisher identity — a domain it controls. Its /.well-known/dedi.index.json MUST list the key below." },
        "key": {
          "type": "object",
          "description": "PUBLIC signing key as an RFC 7517 JWK. Embedded so the file is integrity-verifiable offline. Private key material MUST NOT appear.",
          "required": ["kid", "kty"],
          "additionalProperties": true,
          "properties": {
            "kid": { "type": "string", "description": "Key id; MUST equal proof.verification_method and match a key in the publisher's manifest." },
            "kty": { "type": "string" },
            "crv": { "type": "string" },
            "x": { "type": "string" },
            "y": { "type": "string" },
            "n": { "type": "string" },
            "e": { "type": "string" }
          }
        }
      }
    },
    "namespace": { "type": "string", "description": "The DeDi namespace name (usually the domain); maps to {namespace} in /dedi/lookup." },
    "registry": {
      "type": "object",
      "required": ["name", "schema", "state", "updated_at"],
      "additionalProperties": false,
      "properties": {
        "name": { "type": "string", "description": "Registry (directory) name; maps to {registry_name}." },
        "schema": {
          "description": "The schema the records' `details` conform to: a URL to a JSON Schema, or an inline JSON Schema object. Never anchored to a single central host.",
          "oneOf": [{ "type": "string", "format": "uri" }, { "type": "object" }]
        },
        "state": { "type": "string", "enum": ["live", "inactive"], "description": "Whole-registry lifecycle. 'inactive' retires the directory; treat as not authoritative." },
        "updated_at": { "type": "string", "format": "date-time", "description": "When the registry's content last actually changed (distinct from a re-issue for freshness)." }
      }
    },
    "records": {
      "type": "array",
      "description": "Pure list entries — each a record name and its schema-conformant data.",
      "items": {
        "type": "object",
        "required": ["record_name", "details"],
        "additionalProperties": false,
        "properties": {
          "record_name": { "type": "string", "description": "Record name; maps to {record_name}. MUST be unique within the registry — duplicates make the file invalid. Case-sensitive; no character-set restriction; percent-encoded when used in a URL path. A record is addressed as {namespace}/{registry_name}/{record_name}." },
          "details": { "type": "object", "description": "The schema-conformant payload; same field as the DeDi API Record.details." }
        }
      }
    },
    "proof": {
      "type": "object",
      "description": "Detached JWS over the JCS-canonicalized document with this proof block removed, signed by publisher.key.",
      "required": ["verification_method", "canonicalization", "jws"],
      "additionalProperties": false,
      "properties": {
        "verification_method": { "type": "string", "description": "MUST reference publisher.key.kid." },
        "canonicalization": { "type": "string", "enum": ["JCS"], "description": "RFC 8785." },
        "jws": { "type": "string", "description": "Detached JWS (RFC 7515)." }
      }
    }
  }
}
